{
  "version": "4.0.0-core1",
  "updated": "2026-06-14",
  "scope": "Bukit Core 1.0",
  "skill_count": 15,
  "core_commands": [
    "build",
    "doctor",
    "config",
    "preview",
    "dev",
    "clean",
    "version",
    "completion",
    "seo",
    "geo",
    "publish",
    "deploy"
  ],
  "labs_not_core": [
    "clone",
    "import",
    "webhook",
    "plugin marketplace",
    "theme registry",
    "theme wizard",
    "theme pack",
    "theme install",
    "template tools"
  ],
  "skills": [
    {
      "name": "using-bukit",
      "status": "stable",
      "since": "v4.0.0-core1",
      "type": "gateway",
      "priority": 1,
      "path": "using-bukit/SKILL.md",
      "requires": [],
      "source_anchors": [
        "tests/Bukit.Architecture.Tests/CoreBoundaryTests.cs",
        "src/Bukit-Core/Bukit.Cli/Cli/BukitCliSpecs.cs",
        "guide/skills/skills-index.yaml"
      ],
      "verified_by": [
        "guide/skills/scripts/validate-skills-strict.sh",
        "tests/Bukit.Architecture.Tests/CoreBoundaryTests.cs"
      ],
      "guide_chapters": [
        "guide/skills/README.md"
      ],
      "description": "Core 1.0 gateway and routing rules."
    },
    {
      "name": "bukit-cli-reference",
      "status": "stable",
      "since": "v4.0.0-core1",
      "type": "reference",
      "priority": 2,
      "path": "bukit-cli-reference/SKILL.md",
      "requires": [],
      "source_anchors": [
        "src/Bukit-Core/Bukit.Cli/Cli/BukitCliSpecs.cs",
        "src/Bukit-Core/Bukit.Cli/Cli/BukitCliDescriptors.cs"
      ],
      "verified_by": [
        "guide/skills/scripts/check-cli-commands.py",
        "tests/Bukit.Architecture.Tests/CoreBoundaryTests.cs"
      ],
      "guide_chapters": [
        "guide/skills/README.md"
      ],
      "description": "Source-aligned command and option reference."
    },
    {
      "name": "bukit-config",
      "status": "stable",
      "since": "v4.0.0-core1",
      "type": "reference",
      "priority": 3,
      "path": "bukit-config/SKILL.md",
      "requires": [
        "bukit-cli-reference"
      ],
      "source_anchors": [
        "src/Bukit-Core/Bukit.Config/AppConfig.cs",
        "src/Bukit-Core/Bukit.Config/ConfigLoader.cs",
        "src/Bukit-Core/Bukit.Config/ConfigValidator.cs",
        "src/Bukit-Core/Bukit.Config/ConfigStrictFieldValidator.cs"
      ],
      "verified_by": [
        "tests/Bukit.Config.Tests/ConfigLoaderFullCoverageTests.cs",
        "tests/Bukit.Engine.Tests/ConfigValidatorTests.cs"
      ],
      "guide_chapters": [
        "guide/skills/README.md"
      ],
      "description": "site.yaml Core 1.0 contract."
    },
    {
      "name": "bukit-content",
      "status": "stable",
      "since": "v4.0.0-core1",
      "type": "technique",
      "priority": 4,
      "path": "bukit-content/SKILL.md",
      "requires": [
        "bukit-config"
      ],
      "source_anchors": [
        "src/Bukit-Core/Bukit.Config/AppConfig.cs",
        "src/Bukit-Core/Bukit.Engine/ContentProviderFactory.cs",
        "src/Bukit-Core/Bukit.Content/Markdown/MarkdownFolderProvider.cs"
      ],
      "verified_by": [
        "tests/Bukit.Engine.Tests/ContentProviderFactoryTests.cs",
        "tests/Bukit.Config.Tests/ConfigLoaderTests.cs"
      ],
      "guide_chapters": [
        "guide/skills/README.md"
      ],
      "description": "Markdown and multi-source content contract."
    },
    {
      "name": "bukit-notion",
      "status": "stable",
      "since": "v4.0.0-core1",
      "type": "technique",
      "priority": 5,
      "path": "bukit-notion/SKILL.md",
      "requires": [
        "bukit-config",
        "bukit-content"
      ],
      "source_anchors": [
        "src/Bukit-Core/Bukit.Config/ProviderValidators.cs",
        "src/Bukit-Core/Bukit.Content/Notion/NotionContentProvider.cs",
        "src/Bukit-Core/Bukit.Content/Notion/NotionPropertyParser.cs",
        "src/Bukit-Core/Bukit.Content/Notion/NotionBlockRendererRegistry.cs"
      ],
      "verified_by": [
        "tests/Bukit.Content.Tests/NotionPropertyParserTests.cs",
        "tests/Bukit.Engine.Tests/NotionSchemaDrivenMappingTests.cs"
      ],
      "guide_chapters": [
        "guide/skills/README.md"
      ],
      "description": "Notion content source contract."
    },
    {
      "name": "bukit-routing",
      "status": "stable",
      "since": "v4.0.0-core1",
      "type": "technique",
      "priority": 6,
      "path": "bukit-routing/SKILL.md",
      "requires": [
        "bukit-config",
        "bukit-content"
      ],
      "source_anchors": [
        "src/Bukit-Core/Bukit.Routing/RoutePathBuilder.cs",
        "src/Bukit-Core/Bukit.Routing/RouteGenerator.cs",
        "src/Bukit-Core/Bukit.Routing/RouteSecurityValidator.cs",
        "src/Bukit-Core/Bukit.Engine/RouteInventoryValidator.cs"
      ],
      "verified_by": [
        "tests/Bukit.Routing.Tests/RoutePathBuilderTests.cs",
        "tests/Bukit.Engine.Tests/RouteGeneratorTests.cs"
      ],
      "guide_chapters": [
        "guide/skills/README.md"
      ],
      "description": "URL, permalink, list page, and route conflict rules."
    },
    {
      "name": "bukit-theme",
      "status": "stable",
      "since": "v4.0.0-core1",
      "type": "technique",
      "priority": 7,
      "path": "bukit-theme/SKILL.md",
      "requires": [
        "bukit-config"
      ],
      "source_anchors": [
        "src/Bukit-Core/Bukit.Engine/ThemePathResolver.cs",
        "src/Bukit-Core/Bukit.Config/ConfigValidator.cs",
        "src/Bukit-Core/Bukit.Config/ThemeManifestStrictValidator.cs",
        "src/Bukit-Core/Bukit.Theme/ThemeManifestLoader.cs",
        "src/Bukit-Core/Bukit.Theme/ThemeComponentRegistry.cs"
      ],
      "verified_by": [
        "tests/Bukit.Theme.Tests/ThemeManifestLoaderTests.cs",
        "tests/Bukit.Engine.Tests/ThemePathResolverTests.cs"
      ],
      "guide_chapters": [
        "guide/skills/README.md"
      ],
      "description": "Theme directory and theme.yaml contract."
    },
    {
      "name": "bukit-templating",
      "status": "stable",
      "since": "v4.0.0-core1",
      "type": "technique",
      "priority": 8,
      "path": "bukit-templating/SKILL.md",
      "requires": [
        "bukit-theme"
      ],
      "source_anchors": [
        "src/Bukit-Core/Bukit.Rendering/Scriban/ScribanTemplateRenderer.cs",
        "src/Bukit-Core/Bukit.Rendering/Scriban/TemplateContextBuilder.cs",
        "src/Bukit-Core/Bukit.Engine/ScribanTemplateLinter.cs",
        "src/Bukit-Core/Bukit.Engine/TemplateCapabilitiesResolver.cs"
      ],
      "verified_by": [
        "tests/Bukit.Rendering.Tests/ScribanTemplateRendererTests.cs",
        "tests/Bukit.Engine.Tests/ScribanTemplateLinterTests.cs"
      ],
      "guide_chapters": [
        "guide/skills/README.md"
      ],
      "description": "Scriban template authoring and diagnostics."
    },
    {
      "name": "bukit-i18n",
      "status": "stable",
      "since": "v4.0.0-core1",
      "type": "technique",
      "priority": 9,
      "path": "bukit-i18n/SKILL.md",
      "requires": [
        "bukit-config",
        "bukit-routing"
      ],
      "source_anchors": [
        "src/Bukit-Core/Bukit.Config/I18nValidator.cs",
        "src/Bukit-Core/Bukit.Engine/I18nOutputMerger.cs"
      ],
      "verified_by": [
        "tests/Bukit.Engine.Tests/I18nOutputMergerTests.cs"
      ],
      "guide_chapters": [
        "guide/skills/README.md"
      ],
      "description": "Multilingual site configuration and merged outputs."
    },
    {
      "name": "bukit-seo",
      "status": "stable",
      "since": "v4.0.0-core1",
      "type": "technique",
      "priority": 10,
      "path": "bukit-seo/SKILL.md",
      "requires": [
        "bukit-config",
        "bukit-cli-reference"
      ],
      "source_anchors": [
        "src/Bukit-Core/Bukit.Cli/Commands/SeoCommand.cs",
        "src/Bukit-Core/Bukit.Cli/Commands/SeoReportValidator.cs",
        "src/Bukit-Core/Bukit.Engine/BuildReporter.cs"
      ],
      "verified_by": [
        "tests/Bukit.Cli.Tests/SeoReportValidatorTests.cs",
        "tests/Bukit.Engine.Tests/SeoDiagnosticsTests.cs"
      ],
      "guide_chapters": [
        "guide/skills/README.md"
      ],
      "description": "SEO configuration and report quality gates."
    },
    {
      "name": "bukit-geo",
      "status": "stable",
      "since": "v4.0.0-core1",
      "type": "technique",
      "priority": 11,
      "path": "bukit-geo/SKILL.md",
      "requires": [
        "bukit-config",
        "bukit-seo"
      ],
      "source_anchors": [
        "src/Bukit-Core/Bukit.Cli/Commands/GeoCommand.cs",
        "src/Bukit-Core/Bukit.Engine/BuildReporter.cs"
      ],
      "verified_by": [
        "tests/Bukit.Engine.Tests/GeoDiagnosticsTests.cs",
        "tests/Bukit.Engine.Tests/GeoSeoModelBuilderTests.cs"
      ],
      "guide_chapters": [
        "guide/skills/README.md"
      ],
      "description": "GEO and llms output quality gates."
    },
    {
      "name": "bukit-preview",
      "status": "stable",
      "since": "v4.0.0-core1",
      "type": "operation",
      "priority": 12,
      "path": "bukit-preview/SKILL.md",
      "requires": [
        "bukit-cli-reference"
      ],
      "source_anchors": [
        "src/Bukit-Core/Bukit.Cli/Commands/PreviewCommand.cs"
      ],
      "verified_by": [
        "tests/Bukit.Cli.Tests/PreviewCommandTests.cs",
        "tests/Bukit.Cli.Tests/PreviewCommandExtendedTests.cs"
      ],
      "guide_chapters": [
        "guide/skills/README.md"
      ],
      "description": "Static output preview server."
    },
    {
      "name": "bukit-dev",
      "status": "stable",
      "since": "v4.0.0-core1",
      "type": "operation",
      "priority": 13,
      "path": "bukit-dev/SKILL.md",
      "requires": [
        "bukit-cli-reference",
        "bukit-config"
      ],
      "source_anchors": [
        "src/Bukit-Core/Bukit.Cli/Commands/DevCommand.cs",
        "src/Bukit-Core/Bukit.Cli/Commands/Dev/DevFileWatcher.cs",